### ISSUE TITLE
Potential `Message` parsing regression

### ISSUE THREAD

**Issue by sharksforarms** [ctz/rustls#784]
Hey all,

I noticed a regression in some of our tests at work between 0.19 and 0.20 which I'm wondering if intentional or not. I expected to be able to parse the TLS message, but instead get a `CorruptMessagePayload(Handshake)` on 0.20.0-beta2

This has to do with parsing a encrypted TLS message segment.

Hex
```
1603030059020000550303f9cc9be49de8396abaf596a393c276bb6e3e5fc384713d7c64e112f1b1fb1b0d20fab2c47d44f35babc5ebaf3abdac180866f0ad39a04fd1fc0062aa9425acb674c02f00000dff010001000023000000170000160303006b040000670000a8c000614e5ad61cc9df66ccf5c1659b4cf61adb92231fa174959f472fb7a2f0b03ac7e97ea3c656271eb4324258d3c4534ee9fd37d559a237d5b2eb81ba1482412e8e7c4559c56b731299e79ada5eeac91cfcd428fd6c31ce6592e4f93f32b082fc455aa41403030001011603030028ffbb730dd0b664469af2f811ce46d2ab9d456a32961462cf2a588107faf211b9ff50c128770a187b
```

Here's the associated PCAP (packet 6)

[rustls_message_parse.zip](https://github.com/ctz/rustls/files/6826742/rustls_message_parse.zip)

Pcap generated with tlsserver and firefox.
```
cargo run --example tlsserver -- --certs ./localhost.cert --key ./localhost.key --port 8083 --verbose http --protover 1.2 --tickets
```

Wireshark
```
Frame 6: 323 bytes on wire (2584 bits), 323 bytes captured (2584 bits) on interface lo, id 0
Ethernet II, Src: 00:00:00_00:00:00 (00:00:00:00:00:00), Dst: 00:00:00_00:00:00 (00:00:00:00:00:00)
Internet Protocol Version 4, Src: 127.0.0.1, Dst: 127.0.0.1
Transmission Control Protocol, Src Port: 8083, Dst Port: 33880, Seq: 1, Ack: 518, Len: 257
Transport Layer Security
    TLSv1.2 Record Layer: Handshake Protocol: Server Hello
        Content Type: Handshake (22)
        Version: TLS 1.2 (0x0303)
        Length: 89
        Handshake Protocol: Server Hello
            Handshake Type: Server Hello (2)
            Length: 85
            Version: TLS 1.2 (0x0303)
            Random: f9cc9be49de8396abaf596a393c276bb6e3e5fc384713d7c64e112f1b1fb1b0d
                GMT Unix Time: Oct 22, 2102 00:53:56.000000000 EDT
                Random Bytes: 9de8396abaf596a393c276bb6e3e5fc384713d7c64e112f1b1fb1b0d
            Session ID Length: 32
            Session ID: fab2c47d44f35babc5ebaf3abdac180866f0ad39a04fd1fc0062aa9425acb674
            Cipher Suite: TLS_ECDHE_RSA_WITH_AES_128_GCM_SHA256 (0xc02f)
            Compression Method: null (0)
            Extensions Length: 13
            Extension: renegotiation_info (len=1)
                Type: renegotiation_info (65281)
                Length: 1
                Renegotiation Info extension
                    Renegotiation info extension length: 0
            Extension: session_ticket (len=0)
                Type: session_ticket (35)
                Length: 0
                Data (0 bytes)
            Extension: extended_master_secret (len=0)
                Type: extended_master_secret (23)
                Length: 0
    TLSv1.2 Record Layer: Handshake Protocol: New Session Ticket
        Content Type: Handshake (22)
        Version: TLS 1.2 (0x0303)
        Length: 107
        Handshake Protocol: New Session Ticket
            Handshake Type: New Session Ticket (4)
            Length: 103
            TLS Session Ticket
                Session Ticket Lifetime Hint: 43200 seconds (12 hours)
                Session Ticket Length: 97
                Session Ticket: 4e5ad61cc9df66ccf5c1659b4cf61adb92231fa174959f472fb7a2f0b03ac7e97ea3c656…
    TLSv1.2 Record Layer: Change Cipher Spec Protocol: Change Cipher Spec
        Content Type: Change Cipher Spec (20)
        Version: TLS 1.2 (0x0303)
        Length: 1
        Change Cipher Spec Message
    TLSv1.2 Record Layer: Handshake Protocol: Encrypted Handshake Message
        Content Type: Handshake (22)
        Version: TLS 1.2 (0x0303)
        Length: 40
        Handshake Protocol: Encrypted Handshake Message
```

In 0.20.0-beta2 (last commit is 76db47cdb697e3c9e6149ab2f3164a910f9140c9)

```rust
use hexlit::hex;
use std::convert::TryFrom;
use rustls::{internal::msgs::{codec::Reader, message::{Message, OpaqueMessage}}};

fn main() {
    let out_tls = hex!("1603030059020000550303f9cc9be49de8396abaf596a393c276bb6e3e5fc384713d7c64e112f1b1fb1b0d20fab2c47d44f35babc5ebaf3abdac180866f0ad39a04fd1fc0062aa9425acb674c02f00000dff010001000023000000170000160303006b040000670000a8c000614e5ad61cc9df66ccf5c1659b4cf61adb92231fa174959f472fb7a2f0b03ac7e97ea3c656271eb4324258d3c4534ee9fd37d559a237d5b2eb81ba1482412e8e7c4559c56b731299e79ada5eeac91cfcd428fd6c31ce6592e4f93f32b082fc455aa41403030001011603030028ffbb730dd0b664469af2f811ce46d2ab9d456a32961462cf2a588107faf211b9ff50c128770a187b");

    let mut reader = Reader::init(&out_tls);
    while reader.any_left() {
        let plain = OpaqueMessage::read(&mut reader).unwrap().into_plain_message();
        let msg = Message::try_from(plain).unwrap();
        println!("msg: {:?}", msg);
    }
}

// OUTPUT

msg: Message { version: TLSv1_2, payload: Handshake(HandshakeMessagePayload { typ: ServerHello, payload: ServerHello(ServerHelloPayload { legacy_version: TLSv1_2, random: Random([249, 204, 155, 228, 157, 232, 57, 106, 186, 245, 150, 163, 147, 194, 118, 187, 110, 62, 95, 195, 132, 113, 61, 124, 100, 225, 18, 241, 177, 251, 27, 13]), session_id: SessionID(250, 178, 196, 125, 68, 243, 91, 171, 197, 235, 175, 58, 189, 172, 24, 8, 102, 240, 173, 57, 160, 79, 209, 252, 0, 98, 170, 148, 37, 172, 182, 116), cipher_suite: TLS_ECDHE_RSA_WITH_AES_128_GCM_SHA256, compression_method: Null, extensions: [RenegotiationInfo(PayloadU8([])), SessionTicketAck, ExtendedMasterSecretAck] }) }) }
msg: Message { version: TLSv1_2, payload: Handshake(HandshakeMessagePayload { typ: NewSessionTicket, payload: NewSessionTicket(NewSessionTicketPayload { lifetime_hint: 43200, ticket: PayloadU16([78, 90, 214, 28, 201, 223, 102, 204, 245, 193, 101, 155, 76, 246, 26, 219, 146, 35, 31, 161, 116, 149, 159, 71, 47, 183, 162, 240, 176, 58, 199, 233, 126, 163, 198, 86, 39, 30, 180, 50, 66, 88, 211, 196, 83, 78, 233, 253, 55, 213, 89, 162, 55, 213, 178, 235, 129, 186, 20, 130, 65, 46, 142, 124, 69, 89, 197, 107, 115, 18, 153, 231, 154, 218, 94, 234, 201, 28, 252, 212, 40, 253, 108, 49, 206, 101, 146, 228, 249, 63, 50, 176, 130, 252, 69, 90, 164]) }) }) }
msg: Message { version: TLSv1_2, payload: ChangeCipherSpec(ChangeCipherSpecPayload) }
thread 'main' panicked at 'called `Result::unwrap()` on an `Err` value: CorruptMessagePayload(Handshake)', src/bin/main.rs:200:44
```

Note: This is not an error in 0.19, but instead an `Opaque` payload.

```rust
use hexlit::hex;
use rustls::internal::msgs::{codec::{Codec, Reader}, message::Message};

fn main() {
    let out_tls = hex!("1603030059020000550303f9cc9be49de8396abaf596a393c276bb6e3e5fc384713d7c64e112f1b1fb1b0d20fab2c47d44f35babc5ebaf3abdac180866f0ad39a04fd1fc0062aa9425acb674c02f00000dff010001000023000000170000160303006b040000670000a8c000614e5ad61cc9df66ccf5c1659b4cf61adb92231fa174959f472fb7a2f0b03ac7e97ea3c656271eb4324258d3c4534ee9fd37d559a237d5b2eb81ba1482412e8e7c4559c56b731299e79ada5eeac91cfcd428fd6c31ce6592e4f93f32b082fc455aa41403030001011603030028ffbb730dd0b664469af2f811ce46d2ab9d456a32961462cf2a588107faf211b9ff50c128770a187b");

    let mut reader = Reader::init(&out_tls);
    let mut messages = Vec::new();
    while reader.any_left() {
    let msg = Message::read(&mut reader).unwrap();
        println!("msg: {:?}", msg);
        messages.push(msg);
    }
}

// OUTPUT

msg: Message { typ: Handshake, version: TLSv1_2, payload: Opaque(Payload([2, 0, 0, 85, 3, 3, 249, 204, 155, 228, 157, 232, 57, 106, 186, 245, 150, 163, 147, 194, 118, 187, 110, 62, 95, 195, 132, 113, 61, 124, 100, 225, 18, 241, 177, 251, 27, 13, 32, 250, 178, 196, 125, 68, 243, 91, 171, 197, 235, 175, 58, 189, 172, 24, 8, 102, 240, 173, 57, 160, 79, 209, 252, 0, 98, 170, 148, 37, 172, 182, 116, 192, 47, 0, 0, 13, 255, 1, 0, 1, 0, 0, 35, 0, 0, 0, 23, 0, 0])) }
msg: Message { typ: Handshake, version: TLSv1_2, payload: Opaque(Payload([4, 0, 0, 103, 0, 0, 168, 192, 0, 97, 78, 90, 214, 28, 201, 223, 102, 204, 245, 193, 101, 155, 76, 246, 26, 219, 146, 35, 31, 161, 116, 149, 159, 71, 47, 183, 162, 240, 176, 58, 199, 233, 126, 163, 198, 86, 39, 30, 180, 50, 66, 88, 211, 196, 83, 78, 233, 253, 55, 213, 89, 162, 55, 213, 178, 235, 129, 186, 20, 130, 65, 46, 142, 124, 69, 89, 197, 107, 115, 18, 153, 231, 154, 218, 94, 234, 201, 28, 252, 212, 40, 253, 108, 49, 206, 101, 146, 228, 249, 63, 50, 176, 130, 252, 69, 90, 164])) }
msg: Message { typ: ChangeCipherSpec, version: TLSv1_2, payload: Opaque(Payload([1])) }
msg: Message { typ: Handshake, version: TLSv1_2, payload: Opaque(Payload([255, 187, 115, 13, 208, 182, 100, 70, 154, 242, 248, 17, 206, 70, 210, 171, 157, 69, 106, 50, 150, 20, 98, 207, 42, 88, 129, 7, 250, 242, 17, 185, 255, 80, 193, 40, 119, 10, 24, 123])) }
```

Thanks for the insight!

**Comment by djc** [comment]
The new version of your code is wrong: the 0.20 `Message` type cannot represent encrypted payloads. It should be left as an `OpaqueMessage`, turned into a `PlainMessage` by using a `MessageDecrypter`, and only then can you decode a `Message` from it.

Please don't use ask for support against the internal API. Why/where are you using this?

**Comment by sharksforarms** [comment]
> Please don't use ask for support against the internal API. Why/where are you using this?

My apologies.

I'm using this in a toy project to parse TLS messages from the network.
